{
  "issue": "PLAN-2",
  "titulo": "Esqueleto inicial del backend (Spring Boot)",
  "slug": "esqueleto-inicial-del-backend-spring",
  "rama": "PLAN-2-esqueleto-inicial-del-backend-spring",
  "alcance": [
    "backend"
  ],
  "fase": "cerrar",
  "fases": {
    "preparacion": {
      "estado": "ok",
      "ts": "2026-09-16T12:25:50.767Z"
    },
    "spec": {
      "estado": "ok",
      "ts": "2026-09-16T12:25:50.953Z"
    },
    "plan": {
      "estado": "ok",
      "ts": "2026-09-16T12:48:30.368Z"
    },
    "implementar": {
      "estado": "ok",
      "ts": "2026-09-16T12:52:40.720Z"
    },
    "verificar": {
      "estado": "ok",
      "ts": "2026-09-16T12:54:55.884Z"
    },
    "cerrar": {
      "estado": "pendiente"
    },
    "cerrada": {
      "estado": "pendiente"
    }
  },
  "commits": {
    "backend": "84639a4"
  },
  "revisiones": [
    {
      "n": 1,
      "repo": "backend",
      "motor": "codex",
      "motivo": null,
      "verdict": "needs-attention",
      "bloqueantes": 1,
      "refutados": 1,
      "nota": "El unico hallazgo bloqueante no se reprodujo: ver 05-revision-backend-1-refutacion.md"
    }
  ],
  "pr": {},
  "jira": {
    "transicionadoA": "10005",
    "creadoPorHarness": true
  }
}
